mp3/514e8ea0fcfff2da9d000efb.mp3,hey hon do you want a beer before our show comes on
mp3/514e8ea0fcfff2da9d000efc.mp3,sure thanks it sure is nice to be able to put my feet up after a busy day
mp3/514e8ea0fcfff2da9d000efd.mp3,tell me about it it just sucks that early tomorrow morning we'll be right back at our offices
mp3/514e8ea0fcfff2da9d000efe.mp3,yeah but that's life it's what everyone else has to do too
mp3/514e8ea0fcfff2da9d000eff.mp3,yeah and living in a routine isn't so bad i'm glad we have each other to spice it up
mp3/514e8ea0fcfff2da9d000f00.mp3,yes you are very spicy sh the show is starting
mp3/514e8ea0fcfff2da9d000f01.mp3,it's just the commercials can you give me a foot massage these heels are killing me
mp3/514e8ea0fcfff2da9d000f02.mp3,sure it's one of the many jobs in the job description of the husband
mp3/514e8ea0fcfff2da9d000f03.mp3,i'd give you a promotion any day you are very good at being a husband
mp3/514e8ea0fcfff2da9d000f05.mp3,ha ha we're so cheesy okay now the show is really starting
mp3/514e8f76fcfff2da9d000f8a.mp3,well time to hit the sack
mp3/514e8f76fcfff2da9d000f8b.mp3,i think i'll read my new book a little before going to bed
mp3/514e8f76fcfff2da9d000f8c.mp3,cool we got toothpaste at the store right
mp3/514e8f76fcfff2da9d000f8d.mp3,yeah i put it in our bathroom already
mp3/514e8f76fcfff2da9d000f8e.mp3,what should we do this weekend let's do something fun
mp3/514e8f76fcfff2da9d000f8f.mp3,i don't know i think there's a new museum downtown or we could go hiking
mp3/514e8f76fcfff2da9d000f90.mp3,i have a dentist appointment i think i have to check the calendar
mp3/514e8f76fcfff2da9d000f91.mp3,ugh better you than me i hate the dentist remember when i needed you to hold my hand
mp3/514e8f76fcfff2da9d000f92.mp3,ah you were so cute then well i'm going to bed goodnight babe
mp3/514e8f76fcfff2da9d000f93.mp3,eh screw the book i'll come to bed with you we can cuddle
mp3/51502879fcfff2e8e40605fe.mp3,oh my god i just watched the dark knight such an amazing film
mp3/51502879fcfff2e8e40605ff.mp3,sam the year is 2013 how have you not seen one of modern cinema's greatest films
mp3/51502879fcfff2e8e4060600.mp3,i guess i am behind on the times how skilled is heath ledger as an actor
mp3/51502879fcfff2e8e4060602.mp3,yeah i remember that scene what about it
mp3/51502879fcfff2e8e4060603.mp3,in the very beginning when the joker walks in alfred was supposed to have lines to say
mp3/51502879fcfff2e8e4060604.mp3,i don't remember him saying anything though
mp3/51502879fcfff2e8e4060605.mp3,that's because alfred's actor michael caine was seeing heath ledger as the joker for the first time and he was so shocked that he forgot his lines
mp3/51502879fcfff2e8e4060606.mp3,wow so he was such a good actor that he even scared the actors around him
mp3/51502879fcfff2e8e4060607.mp3,exactly it's a shame that heath ledger passed away at such an early age you should watch his other movies too
mp3/515029a7fcfff2da9d012c44.mp3,i admire forrest gump's undying spirit in the movie forrest gump
mp3/515029a7fcfff2da9d012c45.mp3,do you know if it was based on a true story
mp3/515029a7fcfff2da9d012c46.mp3,unfortunately not i don't think it's humanly possible for anyone to achieve that much in a lifetime
mp3/515029a7fcfff2da9d012c47.mp3,even though forrest gump was the main character my favorite character was bubba
mp3/515029a7fcfff2da9d012c48.mp3,what would make you come to such a conclusion
mp3/515029a7fcfff2da9d012c49.mp3,just his simple morals and inability to see the divisions of color
mp3/515029a7fcfff2da9d012c4a.mp3,well that was deep all i can remember is 50 different methods to prepare shrimp
mp3/515029a7fcfff2da9d012c4b.mp3,shrimp stew shrimp salad fried shrimp barbecued shrimp honey shrimp steamed shrimp sushi shrimp
mp3/515029a7fcfff2da9d012c4c.mp3,okay stop i get it bubba was your favorite character
mp3/515029a7fcfff2da9d012c4d.mp3,i pretty much lost interest in the whole film when he died
mp3/515029a7fcfff2da9d012c4f.mp3,you've already seen the movie don't be such a troll
mp3/51502a77fcfff2da9d012d2b.mp3,what did you think of lord of the rings
mp3/51502a77fcfff2da9d012d2c.mp3,it was kind of boring all they did was walk for most of the movie
mp3/51502a77fcfff2da9d012d2d.mp3,oh no please don't tell me you're one of those critics
mp3/51502a77fcfff2da9d012d2e.mp3,what do you mean by that
mp3/51502a77fcfff2da9d012d2f.mp3,people who say that lord of the rings was boring because all they did was walk to the mountain
mp3/51502a77fcfff2da9d012d30.mp3,well then what is it about
mp3/51502a77fcfff2da9d012d31.mp3,it's about how even the smallest person can make the biggest impact in the world
mp3/51502a77fcfff2da9d012d32.mp3,really i think you're stretching it a bit far
mp3/51502a77fcfff2da9d012d33.mp3,it's about frodo's journey through the depths of despair and how hope and goodness prevailed
mp3/51502a77fcfff2da9d012d34.mp3,honestly it was an entertaining movie but it was just dragged out to be such a long film
mp3/51502a77fcfff2da9d012d35.mp3,clearly you don't understand the underlying elements of the movie
mp3/51502b37fcfff2e8e40607b8.mp3,i think crouching tiger hidden dragon was the first chinese movie to be commercially successful in north america
mp3/51502b37fcfff2e8e40607b9.mp3,it's because it was marketed in a worldwide stage and was well produced
mp3/51502b37fcfff2e8e40607bb.mp3,it also had high-production values something that you normally don't see with most asian films
mp3/51502b37fcfff2e8e40607bd.mp3,yeah the cast was strong too chow yun-fat and michelle yeo starred in some western films too so that really helped
mp3/51502b37fcfff2e8e40607be.mp3,i guess it also benefits that the movie itself was good compared to movies in western cinema
mp3/51502b37fcfff2e8e40607bf.mp3,yup the score was good and the movie sets really displayed how beautiful china can be
mp3/51502b37fcfff2e8e40607c0.mp3,ang lee's movies haven't had the success that crouching tiger hidden dragon had but his movies are still very enjoyable
mp3/51502b37fcfff2e8e40607c1.mp3,yup there still has never been a movie like crouching tiger hidden dragon in western cinema
mp3/51502bdffcfff22d9403172d.mp3,there has never been a trilogy more disappointing than the matrix
mp3/51502bdffcfff22d9403172e.mp3,isn't that the case with most trilogies
mp3/51502bdffcfff22d9403172f.mp3,the problem is that it's hard for each movie to outdo its predecessor
mp3/51502bdffcfff22d94031730.mp3,yeah take the matrix for example the first one was so good it was almost impossible for the next two movies to be better
mp3/51502bdffcfff22d94031731.mp3,just like the original star wars trilogy and the indiana jones trilogy
mp3/51502bdffcfff22d94031732.mp3,yup it's also strange how after the matrix both keanu reeves and carrie anne moss's acting careers died
mp3/51502bdffcfff22d94031733.mp3,i didn't think they were very good actors to begin with so it isn't that surprising
mp3/51502bdffcfff22d94031734.mp3,the matrix will always be remembered for its crazy fight scenes though it was the first movie to have slow-motion fight scenes
mp3/51502bdffcfff22d94031735.mp3,the first matrix will always be one of the greatest movies of our generation
mp3/51502c8dfcfff2e8e4060899.mp3,what would you do if you were ed norton in fight club
mp3/51502c8dfcfff2e8e406089a.mp3,what do you mean by that
mp3/51502c8dfcfff2e8e406089b.mp3,i mean if you found out that someone you thought was real and was close to you was actually a figment of your imagination
mp3/51502c8dfcfff2e8e406089c.mp3,that would be mind-bending i think that's actually a real condition called schizophrenia
mp3/51502c8dfcfff2e8e406089d.mp3,scizo what can you repeat that
mp3/51502c8dfcfff2e8e406089e.mp3,schizophrenia is a condition where you imagine things that aren't real
mp3/51502c8dfcfff2e8e406089f.mp3,oh i see that sounds just like what ed norton's character had in the movie
mp3/51502c8dfcfff2e8e40608a0.mp3,yeah the movie really messes with your mind it's one of those movies that you have to watch again to really understand
mp3/51502c8dfcfff2e8e40608a1.mp3,would you say fight club is a classic movie
mp3/51502c8dfcfff2e8e40608a2.mp3,without a doubt every movie fan should watch it
mp3/51502eb3fcfff21ed4058645.mp3,do you think leonardo dicaprio was dreaming at the end of the film
mp3/51502eb3fcfff21ed4058646.mp3,i didn't think he woke up from his dream
mp3/51502eb3fcfff21ed4058647.mp3,i fully disagree because his totem was slowing down towards the end which implies that it would have fallen down
mp3/51502eb3fcfff21ed4058648.mp3,that may be but the spinning top was not his totem from the beginning that was his wife's totem
mp3/51502eb3fcfff21ed4058649.mp3,but how can you explain how he got out of limbo with saito
mp3/51502eb3fcfff21ed405864a.mp3,well i think he's been dreaming the whole time so anything can happen when you're dreaming
mp3/51502eb3fcfff21ed405864b.mp3,i think the director wanted the ending to be ambiguous so that we can have debates like this
mp3/51502eb3fcfff21ed405864c.mp3,i'm right i don't care what you say
mp3/51502eb3fcfff21ed405864d.mp3,actually you're dreaming and you just think you're right cause you've been inceptioned
mp3/51502eb3fcfff21ed405864e.mp3,inceptioned is not a real word people learning english will get confused
mp3/51502f49fcfff2e8e4060d1b.mp3,did you know that this was only the second movie that james bond got shot in
mp3/51502f49fcfff2e8e4060d1d.mp3,yeah they usually try to portray him as an indestructible human being who never gets hurt
mp3/51502f49fcfff2e8e4060d1e.mp3,the direction of skyfall was to portray bond as a normal person in many ways it personified him as james bond the person
mp3/51502f49fcfff2e8e4060d1f.mp3,that's why it is my favorite bond movie
mp3/51502f49fcfff2e8e4060d20.mp3,it was simple and plot-driven unlike the other movies that had a bunch of gadgets
mp3/51502f49fcfff2e8e4060d21.mp3,i suppose some people actually liked that style of bond more after all it had more entertainment value
mp3/51502f49fcfff2e8e4060d22.mp3,like i've always said plot is the most important element of a movie
mp3/51502fe7fcfff21ed40586bd.mp3,is it just me or does the plot resemble something that i've seen before
mp3/51502fe7fcfff21ed40586be.mp3,the departed is a remake of a hong kong hit infernal affairs
mp3/51502fe7fcfff21ed40586bf.mp3,oh the one with andy lau i love andy lau he's a very talented actor
mp3/51502fe7fcfff21ed40586c0.mp3,i wish i could agree with you but i don't speak chinese so the subtitles do a good job of speaking for him
mp3/51502fe7fcfff21ed40586c1.mp3,i preferred the ending of the departed because it brings closure to the entire movie
mp3/51502fe7fcfff21ed40586c2.mp3,the hong kong version set itself up for a sequel and because of that it wasn't as good as the us version
mp3/51502fe7fcfff21ed40586c3.mp3,if infernal affairs had the same ending as the departed i would have enjoyed it much more
mp3/51502fe7fcfff21ed40586c4.mp3,the departed had a really good cast too a-list actors everywhere
mp3/51502fe7fcfff21ed40586c5.mp3,that's probably why it was more commercially successful
mp3/51503162fcfff2e8e4060dee.mp3,what would it be like if your car could transform into a butt-kicking robot
mp3/51503162fcfff2e8e4060def.mp3,it would be great i'd never get a ticket from a cop again
mp3/51503162fcfff2e8e4060df0.mp3,you probably wouldn't need to fill up on gas either
mp3/51503162fcfff2e8e4060df1.mp3,it would be environmentally friendly and economical
mp3/51503162fcfff2e8e4060df2.mp3,the only problem is that sometimes your car would be called upon to save the world
mp3/51503162fcfff2e8e4060df3.mp3,that is a bit of an inconvenience i suppose
mp3/51503162fcfff2e8e4060df4.mp3,you would also have a carwash every week since it'll probably get really dirty from all its adventures
mp3/51503162fcfff2e8e4060df5.mp3,those would just be battle scars every warrior needs some battle scars
mp3/51503162fcfff2e8e4060df6.mp3,i can't stand a dirty car though
mp3/51503162fcfff2e8e4060df7.mp3,now you're just being trivial you wouldn't get a transforming car because you don't want to pay for a carwash
mp3/51528e5cfcfff25935004074.mp3,oh this stupid alarm i thought i had turned it off
mp3/51528e5cfcfff25935004075.mp3,i thought we were going to sleep in
mp3/51528e5cfcfff25935004076.mp3,you can but i have to run some errands
mp3/51528e5cfcfff25935004078.mp3,just boring stuff i'll see you later for brunch right
mp3/51528e5cfcfff25935004079.mp3,aw come on becca just be lazy with me we can do all that stuff later
mp3/51528e5cfcfff2593500407a.mp3,you look so cute with your bed head
mp3/51528e5cfcfff2593500407c.mp3,ha ha i love you but i'm going to get going
mp3/51528e5cfcfff2593500407d.mp3,okay i'll see you later i'm going to get more shut eye
mp3/5152910dfcfff2b8d300c34d.mp3,hey thanks for meeting me i thought for a minute that you might stand me up
mp3/5152910dfcfff2b8d300c34e.mp3,i'm never too tired to spend time with my lovely wife but let's order some coffee
mp3/5152910dfcfff2b8d300c34f.mp3,you're so sweet do you want a mimosa that sounds delicious
mp3/5152910dfcfff2b8d300c350.mp3,mimosas are for girls becca i'll have a bloody mary
mp3/5152910dfcfff2b8d300c351.mp3,ha ha a mimosa is orange juice and champagne thomas how is that feminine
mp3/5152910dfcfff2b8d300c352.mp3,i don't know i want a whole plate of bacon is that on the menu
mp3/5152910dfcfff2b8d300c353.mp3,eww you'd have a heart attack right at the table if you ordered that
mp3/5152910dfcfff2b8d300c354.mp3,yeah yeah i have a basketball game with my buddies after this want to go to the museum after
mp3/5152910dfcfff2b8d300c355.mp3,sure i have a lot of shopping to do so that's perfect
mp3/5152910dfcfff2b8d300c356.mp3,great this is a nice day glad i got out of hibernation for it
mp3/51529535fcfff219b500ce56.mp3,becca you came to my game
mp3/51529535fcfff219b500ce57.mp3,well you look pretty sexy dominating the court i couldn't resist
mp3/51529535fcfff219b500ce58.mp3,well thank you if you see me dunking i'm trying to impress you
mp3/51529535fcfff219b500ce59.mp3,wow look at that guy he's a giant
mp3/51529535fcfff219b500ce5b.mp3,it looks like they're about to start where are the refs
mp3/51529535fcfff219b500ce5c.mp3,becca it's a pickup game there are no refs
mp3/51529535fcfff219b500ce5e.mp3,no one's going to fight we're civilized human beings don't worry
mp3/51529535fcfff219b500ce5f.mp3,okay good luck i love you
mp3/515296bdfcfff293d700cc56.mp3,you were so awesome in the game tom
mp3/515296bdfcfff293d700cc57.mp3,thanks now because you came to my game does that mean you want me to come shopping with you
mp3/515296bdfcfff293d700cc58.mp3,ha ha no i wouldn't do that to you i just have to return something and exchange something
mp3/515296bdfcfff293d700cc59.mp3,okay i think i'm going to go to the library
mp3/515296bdfcfff293d700cc5a.mp3,nice i'm going to the mall with that great food court you want me to get you anything
mp3/515296bdfcfff293d700cc5b.mp3,do they still have those huge cookies with the frosting if so then yes
mp3/515296bdfcfff293d700cc5c.mp3,ha ha okay i shouldn't be long
mp3/515296bdfcfff293d700cc5d.mp3,nah take your time i don't mind being stuck at a library
mp3/515296bdfcfff293d700cc5e.mp3,okay i'm going to go i should be done in about two hours
mp3/51529adbfcfff2b8d300c834.mp3,sounds good i brush my teeth twice a day and floss once a day just so you know
mp3/51529adbfcfff2b8d300c835.mp3,i can tell you have very nice teeth
mp3/51529adbfcfff2b8d300c836.mp3,thank you that was the first thing my wife noticed about me when we were dating
mp3/51529adbfcfff2b8d300c837.mp3,really when you floss do you get back by your molars
mp3/51529adbfcfff2b8d300c839.mp3,it says on your chart that you've had four cavities do you eat a lot of sugar
mp3/51529adbfcfff2b8d300c83a.mp3,umm to be honest yes my wife is probably buying me a frosted cookie as we speak
mp3/51529adbfcfff2b8d300c83b.mp3,for the health of your teeth you might want to consider cutting out sugar
mp3/51529adbfcfff2b8d300c83c.mp3,oh that's sad that's really sad doctor
mp3/5152f191fcfff219b5011722.mp3,hello miss librarian i'd like to check these books out please
mp3/5152f191fcfff219b5011723.mp3,sure did you find all your books okay
mp3/5152f191fcfff219b5011724.mp3,i did i like the new addition to the library those comfy chairs are great
mp3/5152f191fcfff219b5011725.mp3,and we have a new children's section with a lot of reading nooks for the kids
mp3/5152f191fcfff219b5011726.mp3,i wish you had reading nooks for adults
mp3/5152f191fcfff219b5011727.mp3,oh you have a fine on your library card it's \$3.00
mp3/5152f191fcfff219b5011729.mp3,and here are your books they are due back in four weeks have a good day
mp3/5152f275fcfff25935009135.mp3,hey honey i ordered you a tea i got a coffee how was the mall
mp3/5152f275fcfff25935009136.mp3,ugh it was busy the road on the way there was a parking lot and it's turned into a hangout for obnoxious teenagers
mp3/5152f275fcfff25935009137.mp3,we were once those obnoxious teenagers oh hey i have no cavities although the dentist said i need to cut out sugar
mp3/5152f275fcfff25935009138.mp3,ha ha like that's ever going to happen
mp3/5152f275fcfff25935009139.mp3,here's our tea i got you english breakfast tea even though it's not breakfast
mp3/5152f275fcfff2593500913a.mp3,no that's my favorite kind thank you what did you order
mp3/5152f275fcfff2593500913b.mp3,a coffee with two extra shots of espresso it's that time of day that i seem to hit a wall
mp3/5152f275fcfff2593500913c.mp3,do you still want to go to the museum
mp3/5152f275fcfff2593500913d.mp3,yeah i'll be fine after this coffee do you like your tea
mp3/5152f350fcfff219b5011bb3.mp3,so there are a few museums we can go to pick one science history or art or all three
mp3/5152f350fcfff219b5011bb4.mp3,you can decide i'm fine with anything
mp3/5152f350fcfff219b5011bb5.mp3,are you just going to be watching football on your ipod remember when you did that at the opera
mp3/5152f350fcfff219b5011bb6.mp3,ha ha hey now i thought you forgave me for that forgive and forget that's what they say
mp3/5152f350fcfff219b5011bb7.mp3,okay well we have a membership at the art museum admission will be free
mp3/5152f350fcfff219b5011bb8.mp3,let's go to the art museum then there's less to read
mp3/5152f350fcfff219b5011bb9.mp3,you are such a funny man
mp3/5152f350fcfff219b5011bba.mp3,maybe you can talk to the security guard again like you did last year
mp3/5152f350fcfff219b5011bbb.mp3,and then someone robbed the gift shop i remember that it was all my fault for distracting the guard
mp3/5152f63efcfff2b8d3011f42.mp3,well that was wonderful weren't those paintings beautiful
mp3/5152f63efcfff2b8d3011f43.mp3,yeah and good news the ravens won the game
mp3/5152f63efcfff2b8d3011f44.mp3,very funny i think i'm going to the gym now you want to go
mp3/5152f63efcfff2b8d3011f45.mp3,sure i ran for an hour on the treadmill the other day and i want to see if i can bench over two hundred pounds
mp3/5152f63efcfff2b8d3011f46.mp3,honey that's awesome i'm taking a yoga class there in the fitness center and it's fantastic
mp3/5152f63efcfff2b8d3011f47.mp3,we might need to renew our membership there it's been over a year i think
mp3/5152f63efcfff2b8d3011f48.mp3,sure i can do that after my class do you use dumbbells to bench
mp3/5152f63efcfff2b8d3011f49.mp3,nope you put the weights on a bar and then lift the bar while lying down
mp3/5152f63efcfff2b8d3011f4a.mp3,i know what bench pressing is you jerk
mp3/5152f63efcfff2b8d3011f4b.mp3,ha ha just making sure my flower
mp3/5152f736fcfff219b50124c0.mp3,wow that was a good workout now let's shop for groceries for dinner tonight
mp3/5152f736fcfff219b50124c1.mp3,i'll make spaghetti with my famous sauce i'll need tomatoes and garlic and zucchini
mp3/5152f736fcfff219b50124c2.mp3,that's down the veggie aisle here wait we need a shopping cart
mp3/5152f736fcfff219b50124c3.mp3,let's get a bottle of wine too the liquor department is on the other side of the store
mp3/5152f736fcfff219b50124c4.mp3,oooh the store's giving out free samples by the desserts
mp3/5152f736fcfff219b50124c6.mp3,look at the checkout lanes so many people
mp3/5152f736fcfff219b50124c7.mp3,yeah wow it really is busy here come on let's get going i'm hungry
mp3/5152f7eefcfff2b8d3012280.mp3,okay madam you chop up the vegetables and i'll get the sauce started
mp3/5152f7eefcfff2b8d3012281.mp3,do you know where the cutting board is i can't find it
mp3/5152f7eefcfff2b8d3012282.mp3,it's next to the stove hey i think we need to get this stove fixed a burner isn't working
mp3/5152f7eefcfff2b8d3012283.mp3,i've rinsed the vegetables and now i'll chop them up
mp3/5152f7eefcfff2b8d3012284.mp3,wow this stove is terrible it's burning now
mp3/5152f7eefcfff2b8d3012285.mp3,oh my gosh it's smoking tom i can see a flame
mp3/5152f7eefcfff2b8d3012286.mp3,the smoke detector is going off now it's so loud use the dish cloth to fan the smoke away
mp3/5152f7eefcfff2b8d3012287.mp3,oh no the noodles are burning tom
mp3/5152f7eefcfff2b8d3012288.mp3,shit becca i just knocked over the wine and it broke all over the floor
mp3/5152f7eefcfff2b8d3012289.mp3,oh my gosh tom this is a disaster
mp3/5152fdf8fcfff293d7013162.mp3,well since we almost burnt down the apartment we get to eat out
mp3/5152fdf8fcfff293d7013163.mp3,way to look on the bright side becca
mp3/5152fdf8fcfff293d7013164.mp3,do you want an appetizer i could go for something fatty and bad for me
mp3/5152fdf8fcfff293d7013165.mp3,ha ha yes this restaurant's specialty appetizer is their huge plate of nachos want to get that
mp3/5152fdf8fcfff293d7013166.mp3,that sounds awesome well i'm ready to order where's the server
mp3/5152fdf8fcfff293d7013168.mp3,i served for a summer too some families wouldn't tip and it got me so upset
mp3/5152fdf8fcfff293d7013169.mp3,yeah servers depend on tips that's for sure
mp3/5152fdf8fcfff293d701316a.mp3,oooh look at the dessert menu chocolate cake baby
mp3/5152fdf8fcfff293d701316b.mp3,don't tempt me the dentist told me to cut out sugar
mp3/5152fdf8fcfff293d701316c.mp3,ah come on you only live once
mp3/5152ff10fcfff293d70132e3.mp3,tom i just got a text from vera and david they want to go to the karaoke bar
mp3/5152ff10fcfff293d70132e4.mp3,aw man i wanted to go home and relax
mp3/5152ff10fcfff293d70132e5.mp3,we don't have to go for long just a few songs you know you love to sing
mp3/5152ff10fcfff293d70132e6.mp3,yes this is true okay let's go for only a half an hour okay
mp3/5152ff10fcfff293d70132e7.mp3,i'll buy you a beer you're such a good sport
mp3/5152ff10fcfff293d70132e8.mp3,oh i think i'm excited to sing some classic rock songs i play the air guitar better than anyone
mp3/5152ff10fcfff293d70132e9.mp3,i think i fell in love with you when you were playing the air guitar
mp3/5152ff10fcfff293d70132ea.mp3,really your twenty forth birthday party i think it was
mp3/5152ff10fcfff293d70132eb.mp3,yep i knew i loved you seeing you rocking out to the rolling stones
mp3/5152ff10fcfff293d70132ec.mp3,i'm glad you like a wild and crazy guy okay a half an hour then we go home
mp3/5153005cfcfff2b8d3013c1c.mp3,i rented a few movies from the library today do you like what i picked
mp3/5153005cfcfff2b8d3013c1d.mp3,oooh good choices let's watch this comedy one i feel like laughing
mp3/5153005cfcfff2b8d3013c1e.mp3,good me too i'll make some popcorn
mp3/5153005cfcfff2b8d3013c20.mp3,why do women love to cuddle so much i don't understand
mp3/5153005cfcfff2b8d3013c21.mp3,oh you know you love to cuddle too i'm going to fast forward through the previews
mp3/5153005cfcfff2b8d3013c22.mp3,don't fast forward through the opening credits i like to watch the whole movie
mp3/5153005cfcfff2b8d3013c23.mp3,that's so funny because i love to watch the closing credits
mp3/5153005cfcfff2b8d3013c24.mp3,that's when i knew i loved you when we were the first to come and the last to leave the theater
mp3/5153005cfcfff2b8d3013c25.mp3,we were kids then hurry up with the popcorn the movie's starting
mp3/51530138fcfff219b50136ca.mp3,what are you on your laptop for i thought we were watching the movie
mp3/51530138fcfff219b50136cc.mp3,what didn't you go to the mall today
mp3/51530138fcfff219b50136cd.mp3,i'm shopping for something really really special
mp3/51530138fcfff219b50136ce.mp3,becca we should try to save money i know we're doing really well financially but
mp3/51530138fcfff219b50136cf.mp3,i'm not buying shoes tom i'm on expedia dot com
mp3/51530138fcfff219b50136d0.mp3,expedia isn't that a travel website
mp3/51530138fcfff219b50136d1.mp3,yep i'm shopping for a two person trip to the tropics
mp3/51530138fcfff219b50136d2.mp3,what are you getting at foxy lady
mp3/51530138fcfff219b50136d3.mp3,we are going to the philippines next year my love the adventure of a lifetime
mp3/515508acfcfff203ce00c92d.mp3,good evening dave have you had your dinner yet
mp3/515508acfcfff203ce00c92f.mp3,no how about a burger and fries from mcdonald's
mp3/515508acfcfff203ce00c930.mp3,i don't know it's rush hour there might be no empty seats
mp3/515508acfcfff203ce00c932.mp3,i guess you are right let me wrap up what i was doing
mp3/515508acfcfff203ce00c933.mp3,there's no need to rush we've got enough time
mp3/515508acfcfff203ce00c934.mp3,thank you for stopping by i hate eating alone
mp3/515508acfcfff203ce00c935.mp3,my pleasure i didn't really feel like cooking today
mp3/515508acfcfff203ce00c936.mp3,getting fast food once in a while isn't too bad right
mp3/51550b72fcfff26b7100c956.mp3,john are you coming home for dinner
mp3/51550b72fcfff26b7100c957.mp3,no mom i'm meeting tim and mike this evening
mp3/51550b72fcfff26b7100c958.mp3,well why don't you guys go check out the new italian restaurant that opened yesterday
mp3/51550b72fcfff26b7100c959.mp3,the one next to the mall
mp3/51550b72fcfff26b7100c95a.mp3,yes it looked like they were having some kind of promotional discount
mp3/51550b72fcfff26b7100c95c.mp3,try it and tell me what you and your friends think
